domain_key,section_key,pair_key,limitation_label,pattern_cost,range_narrowing,weaker_signal_key,weaker_signal_link,authoring_status,notes,ready_for_import
leadership-approach,limitation,results_process,When structure outruns commitment,"The cost of this pattern is not a lack of ambition or discipline. The cost is a possible narrowing of the leadership field. When Process and Results dominate, the work can become the clearest object of attention. Plans, standards, timelines, risks, and outcomes may receive more leadership energy than the signals coming from the people who must carry the work. This can make the pattern highly effective in the short term, especially when the route is clear and the team already has confidence in the direction.","The limitation appears when the situation requires emotional calibration, relational repair, or a more patient reading of stakeholder appetite. In those moments, a stronger operating system will not always solve the underlying leadership problem. It may even increase resistance if people feel the system is being tightened before their concerns have been understood.",people,"The People signal is therefore the missing range to develop around this result. The practical question is not whether to become less structured or less outcome-focused. It is whether your structure is carrying enough human intelligence. A stronger range would ask: who needs to be heard before the plan hardens, where confidence is thin, what informal resistance is forming, and what would make ownership feel real rather than merely assigned.",complete,Gold-standard results_process limitation row,TRUE
leadership-approach,limitation,results_vision,,,,,,todo,Author limitation for Results and Vision runtime-order pair,FALSE
leadership-approach,limitation,results_people,,,,,,todo,Author limitation for Results and People runtime-order pair,FALSE
leadership-approach,limitation,process_vision,,,,,,todo,Author limitation for Process and Vision runtime-order pair,FALSE
leadership-approach,limitation,process_people,,,,,,todo,Author limitation for Process and People runtime-order pair,FALSE
leadership-approach,limitation,vision_people,,,,,,todo,Author limitation for Vision and People runtime-order pair,FALSE
